username,email,password_hash,bio
sato_k1,sato_k1@example.jp,$2a$10$gEYnI1DoFwMlJhhmOOdkGe/I3nGiDhVGeJJGSNwn7giAMiAoaXg8C,都内で働くITエンジニアです。趣味は週末のサイクリングと、最近始めたボルダリング！プログラミングのTipsや、日々のトレーニング記録を呟きます。たまに自作のコードを公開したりもします。よろしくお願いします！
yuki_natural,yuki_n@example.com,$2a$10$gEYnI1DoFwMlJhhmOOdkGe/I3nGiDhVGeJJGSNwn7giAMiAoaXg8C,カフェ巡りとカメラが大好き。週末は一人でふらっと国内旅行に出かけ、お城や遺跡を巡るのが生きがいです。日常の何気ない風景を写真に収めてアップしています。お花やガーデニングが好きな方と繋がりたいです。
tanaka_benkyo,t.benkyo@example.ne.jp,$2a$10$gEYnI1DoFwMlJhhmOOdkGe/I3nGiDhVGeJJGSNwn7giAMiAoaXg8C,現在、税理士試験に向けて猛勉強中の20代です。Excelでのデータ処理や財務知識には自信あり。ここでは勉強の進捗報告や、モチベーション維持のために活動しています。資格取得を目指している方、一緒に頑張りましょう！
neko_daisuki,cat_love_99@example.com,$2a$10$gEYnI1DoFwMlJhhmOOdkGe/I3nGiDhVGeJJGSNwn7giAMiAoaXg8C,保護猫3匹と暮らす毎日。ペットの飼育に関する悩みや、可愛い動画を投稿します。特技は創作料理で、猫用のおやつも手作りしています。動物愛護や環境保護活動にも関心があります。無言フォロー失礼します。
ryo_guitar,ryo_gt_music@example.jp,$2a$10$gEYnI1DoFwMlJhhmOOdkGe/I3nGiDhVGeJJGSNwn7giAMiAoaXg8C,ギター歴10年。最近はウクレレや作曲にも挑戦中。音楽鑑賞が趣味で、特にライブ配信やコンサートにはよく足を運びます。DTMでの音楽編集も勉強中。音楽好きのフォロワーさん募集中です！一緒にセッションしましょう！
miki_handmade,miki_h@example.com,$2a$10$gEYnI1DoFwMlJhhmOOdkGe/I3nGiDhVGeJJGSNwn7giAMiAoaXg8C,編み物や裁縫、ハンドメイドアクセサリーを作っています。水彩画を描くのも好きです。作品の制作過程や、お気に入りの手芸用品を紹介します。たまにフリマアプリにも出品中。手作りが好きな方、仲良くしてください。
ken_fishing,ken_fish_01@example.jp,$2a$10$gEYnI1DoFwMlJhhmOOdkGe/I3nGiDhVGeJJGSNwn7giAMiAoaXg8C,釣りバカです。週末はだいたい海か川にいます。キャンプも大好きで、釣った魚をその場で料理するのが最高に幸せ。DIYでキャンプ道具を自作するのも趣味。自然を愛する皆さんと情報交換したいです。
asuka_beauty,asuka_cosme@example.ne.jp,$2a$10$gEYnI1DoFwMlJhhmOOdkGe/I3nGiDhVGeJJGSNwn7giAMiAoaXg8C,美容とメイク、ネイルが大好き。最新のコスメ情報や、スキンケアのルーティンを発信中。特技は似顔絵とロゴデザイン。インフルエンサーを目指してSNS運用を頑張っています。おしゃれなものに囲まれて生きたい。
hiro_history,hiro_hist@example.com,$2a$10$gEYnI1DoFwMlJhhmOOdkGe/I3nGiDhVGeJJGSNwn7giAMiAoaXg8C,歴史と古美術に魅了されています。休日は博物館巡りや、古本屋で珍しい資料を探すのが日課。漢字検定1級取得。書道も嗜みます。過去の偉人の名言や、歴史的背景に基づいた考察を投稿するのが趣味です。
yumi_yoga,yumi_y_zen@example.jp,$2a$10$gEYnI1DoFwMlJhhmOOdkGe/I3nGiDhVGeJJGSNwn7giAMiAoaXg8C,ヨガインストラクターをしています。心と体の健康のために、座禅やアロマテラピーも取り入れています。特技は悩み相談。皆さんの心が少しでも軽くなるような言葉を届けたいです。オーガニックな生活を心がけています。
shogi_master_t,shogi_t@example.com,$2a$10$gEYnI1DoFwMlJhhmOOdkGe/I3nGiDhVGeJJGSNwn7giAMiAoaXg8C,将棋と囲碁をこよなく愛する大学生。戦術の研究や、ネット対局の結果を記録しています。暗算が得意で、数学も大好き。チェスやパズルなどの頭脳ゲーム全般に興味があります。対局相手はいつでも募集中です！
depression_diary,dark_side_v@example.jp,$2a$10$gEYnI1DoFwMlJhhmOOdkGe/I3nGiDhVGeJJGSNwn7giAMiAoaXg8C,毎日が辛い。仕事に行きたくない。消えたい。誰にも言えない本音をここでだけ吐き出します。鬱アカウントです。同じような境遇の方と繋がれたら少しは楽になれるかな。愚痴やネガティブな発言が多いので注意。
traveler_shun,shun_trip@example.com,$2a$10$gEYnI1DoFwMlJhhmOOdkGe/I3nGiDhVGeJJGSNwn7giAMiAoaXg8C,世界一周を目指して貯金中。現在は国内の離島巡りにハマっています。旅行の計画を立てるのが得意で、おすすめのスポットを紹介します。外国語（英語・中国語）を独学中。多文化に触れるのが最高の贅沢です。
cooking_papa,cook_p_07@example.jp,$2a$10$gEYnI1DoFwMlJhhmOOdkGe/I3nGiDhVGeJJGSNwn7giAMiAoaXg8C,3児の父。週末は家族のためにフルコースを作ります。お菓子作りも得意。家庭菜園で育てた野菜を使ったレシピを公開中。整理収納アドバイザーの資格も持っています。家事育児を楽しむパパの日常です。
nana_dance,nana_d_ballet@example.ne.jp,$2a$10$gEYnI1DoFwMlJhhmOOdkGe/I3nGiDhVGeJJGSNwn7giAMiAoaXg8C,クラシックバレエと日本舞踊を習っています。舞台裏の様子や、日々のレッスンの記録を投稿。動画編集が特技で、踊ってみた動画もアップしています。表現することの楽しさを多くの人に伝えたいです！
taka_politics,taka_p_opinion@example.com,$2a$10$gEYnI1DoFwMlJhhmOOdkGe/I3nGiDhVGeJJGSNwn7giAMiAoaXg8C,社会問題や政治について、自分なりの意見を発信します。リサーチとデータ分析が趣味。現在の日本が抱える課題について、フォロワーの皆さんと真剣に議論したいと考えています。忖度なしで発言します。
hana_flower,hana_f_arr@example.jp,$2a$10$gEYnI1DoFwMlJhhmOOdkGe/I3nGiDhVGeJJGSNwn7giAMiAoaXg8C,生け花とフラワーアレンジメントの教室を開いています。ハーバリウム作りも好き。お花がある暮らしの素晴らしさを広めたい。特技は筆ペン字。美しい文字と花に囲まれた、穏やかな生活を目指しています。
game_streamer_x,game_x_live@example.com,$2a$10$gEYnI1DoFwMlJhhmOOdkGe/I3nGiDhVGeJJGSNwn7giAMiAoaXg8C,新作からレトロゲームまで幅広くプレイ。YouTubeやライブ配信で実況をしています。動画マーケティングやSEO対策を勉強して、チャンネル登録者数を増やすのが目標。ゲームの攻略情報や裏技をシェアします。
takuya_run,taku_run_marathon@example.jp,$2a$10$gEYnI1DoFwMlJhhmOOdkGe/I3nGiDhVGeJJGSNwn7giAMiAoaXg8C,フルマラソン完走を目指して毎日ジョギング中。筋トレも欠かしません。スポーツ観戦も大好きで、特にバスケと野球のシーズンは熱くなります。健康管理と自己管理の記録用アカウント。継続は力なり！
saori_uranai,saori_star@example.com,$2a$10$gEYnI1DoFwMlJhhmOOdkGe/I3nGiDhVGeJJGSNwn7giAMiAoaXg8C,占星術とタロット占いをしています。お香とパワースポット巡りが趣味。日々の運勢や、心を整えるためのヒントを投稿します。スピリチュアルなことに興味がある方、お気軽にフォローしてくださいね。
kenji_tech,kenji_infra@example.jp,$2a$10$gEYnI1DoFwMlJhhmOOdkGe/I3nGiDhVGeJJGSNwn7giAMiAoaXg8C,サーバー・インフラ構築のプロフェッショナル。ITサポートやコンサルの仕事もしています。最新のガジェットやテックニュースを共有。仕事の合間に、趣味の天体観測と写真撮影を楽しんでいます。
yuka_diet,yuka_d_style@example.ne.jp,$2a$10$gEYnI1DoFwMlJhhmOOdkGe/I3nGiDhVGeJJGSNwn7giAMiAoaXg8C,万年ダイエッターから卒業したい！10kg減量を目指して、糖質制限メニューや宅トレ動画を記録。たまに心が折れて食べ歩きに走ることも…。ありのままのダイエット奮闘記です。応援してくれると嬉しいです！
kazu_bike,kazu_b_road@example.com,$2a$10$gEYnI1DoFwMlJhhmOOdkGe/I3nGiDhVGeJJGSNwn7giAMiAoaXg8C,ロードバイクで全国を駆け抜けるのが夢。バイクのメンテナンスやカスタマイズが趣味。ツーリング先の絶景やグルメ写真をアップします。週末はだいたい道の上にいます。ヤエーしてね！
mariko_kimono,mariko_k@example.jp,$2a$10$gEYnI1DoFwMlJhhmOOdkGe/I3nGiDhVGeJJGSNwn7giAMiAoaXg8C,着付け講師です。着物でのお出かけや、和の文化を大切にする暮らし。茶道も嗜みます。特技は手話。和服の良さを若い世代にも伝えていきたい。古き良きものを愛でるフォロワーさんと繋がりたいです。
daiki_baseball,daiki_b_ball@example.com,$2a$10$gEYnI1DoFwMlJhhmOOdkGe/I3nGiDhVGeJJGSNwn7giAMiAoaXg8C,中学からずっと野球一筋。今は社会人チームで活動中。バレーボールや水泳も好き。スポーツ全般の分析をするのが得意です。試合の結果に一喜一憂する熱い日常を投稿。たまにプロ野球の現地観戦も。
momo_illust,momo_i_art@example.jp,$2a$10$gEYnI1DoFwMlJhhmOOdkGe/I3nGiDhVGeJJGSNwn7giAMiAoaXg8C,フリーランスのイラストレーター。似顔絵やマンガ制作の依頼を受けています。水彩画と油絵も勉強中。日常の些細な出来事を4コマ漫画にしてアップしています。絵を描くのが好きな人と交流したいです。
satoshi_train,satoshi_t_rail@example.com,$2a$10$gEYnI1DoFwMlJhhmOOdkGe/I3nGiDhVGeJJGSNwn7giAMiAoaXg8C,撮り鉄兼乗り鉄。鉄道の歴史やダイヤ改正に詳しいです。日本全国のローカル線を制覇するのが目標。コイン収集や切手収集も細々と続けています。鉄道模型の製作過程もたまに載せます。
rina_vocal,rina_v_sing@example.jp,$2a$10$gEYnI1DoFwMlJhhmOOdkGe/I3nGiDhVGeJJGSNwn7giAMiAoaXg8C,ゴスペルコーラスグループに所属。歌うことが人生の喜び。作詞もしています。週末はカラオケや音楽フェスに参加。特技は早起きとデータ入力。音楽と仕事の両立を目指す、ポジティブな毎日です。
hide_diy,hide_d_create@example.com,$2a$10$gEYnI1DoFwMlJhhmOOdkGe/I3nGiDhVGeJJGSNwn7giAMiAoaXg8C,週末DIYヤー。家具作りから部屋の改装まで何でもやります。工具を集めるのが趣味。盆栽を育てることにもハマっています。作ったものの紹介や、DIYのコツをシェア。家を自分好みに変えていくのが楽しい！
yoko_volunteer,yoko_v_earth@example.jp,$2a$10$gEYnI1DoFwMlJhhmOOdkGe/I3nGiDhVGeJJGSNwn7giAMiAoaXg8C,ボランティア活動と募金活動に積極的に参加しています。環境保護のために自分ができることを模索中。座禅で精神を統一するのが日課。日々の感謝の気持ちを綴ります。世界が平和でありますように。
shufu_mama,shufu_m_31@example.com,$2a$10$gEYnI1DoFwMlJhhmOOdkGe/I3nGiDhVGeJJGSNwn7giAMiAoaXg8C,2児の母です。日々の家計管理や育児のバタバタ、スーパーの特売情報などを呟きます。たまの息抜きは子供が寝た後のコーヒータイム。同じ子育て世代の方と繋がりたいです！
movie_blogger,movie_b_32@example.jp,$2a$10$gEYnI1DoFwMlJhhmOOdkGe/I3nGiDhVGeJJGSNwn7giAMiAoaXg8C,年間100本以上鑑賞する映画ブロガー。IMAXやドルビーアトモスでの劇場体験を重視しています。新作から過去の名作、B級ホラーまで幅広くレビュー。映画好きと語り合いたいです。
coffee_mania,coffee_m_33@example.com,$2a$10$gEYnI1DoFwMlJhhmOOdkGe/I3nGiDhVGeJJGSNwn7giAMiAoaXg8C,自家焙煎珈琲の魅力に取り憑かれています。浅煎りから深煎りまで、豆の産地や抽出方法にこだわる毎日。カフェ巡りも好きで、究極の一杯を常に探求しています。
sauna_lover,sauna_l_34@example.ne.jp,$2a$10$gEYnI1DoFwMlJhhmOOdkGe/I3nGiDhVGeJJGSNwn7giAMiAoaXg8C,全国のサウナを巡るサウナー。水風呂の温度と外気浴の環境にこだわりあり。サウナハット収集家。「ととのう」感覚と、その後のサウナ飯のために生きています。
vintage_girl,vintage_g_35@example.jp,$2a$10$gEYnI1DoFwMlJhhmOOdkGe/I3nGiDhVGeJJGSNwn7giAMiAoaXg8C,下北沢や高円寺の古着屋に出没する古着女子。70〜80年代のレトロなアイテムが好き。ダメージジーンズの補修やリメイクも自分でやります。服が持つ物語を大切にしたい。
history_walker,history_w_36@example.com,$2a$10$gEYnI1DoFwMlJhhmOOdkGe/I3nGiDhVGeJJGSNwn7giAMiAoaXg8C,休日はもっぱら史跡や古墳、神社仏閣巡り。古代から戦国時代まで日本の歴史全般が好きです。歴史的な背景を知った上でその地に立つと、見えてくる景色が変わります。
camp_solo,camp_s_37@example.jp,$2a$10$gEYnI1DoFwMlJhhmOOdkGe/I3nGiDhVGeJJGSNwn7giAMiAoaXg8C,年中無休でソロキャンプに行くキャンプ女子。特に冬の雪中キャンプと焚き火が大好き。メスティンで作るキャンプ飯のレパートリーには自信があります。自然の中でデトックス。
kpop_stan,kpop_s_38@example.com,$2a$10$gEYnI1DoFwMlJhhmOOdkGe/I3nGiDhVGeJJGSNwn7giAMiAoaXg8C,推しのK-POPアイドルグループを全力で応援中！韓国ドラマにもどっぷりハマっています。韓国語も独学中。新大久保でのコスメ＆グルメ巡りが休日の楽しみです。
minimalist_life,mini_l_39@example.ne.jp,$2a$10$gEYnI1DoFwMlJhhmOOdkGe/I3nGiDhVGeJJGSNwn7giAMiAoaXg8C,「持たない暮らし」を実践するミニマリスト。定期的なデジタルデトックスで心を整え、本当に必要なものだけを厳選して生活しています。部屋の余白は心の余白。
photo_light,photo_l_40@example.jp,$2a$10$gEYnI1DoFwMlJhhmOOdkGe/I3nGiDhVGeJJGSNwn7giAMiAoaXg8C,愛機ライカと共に、日常の光と影を切り取る写真家。風景やポートレートの現像作業に没頭する時間が好き。ファインダー越しに見る世界は、肉眼とは違う真実を教えてくれます。
sweets_hunter,sweets_h_41@example.com,$2a$10$gEYnI1DoFwMlJhhmOOdkGe/I3nGiDhVGeJJGSNwn7giAMiAoaXg8C,新作スイーツやホテルのアフタヌーンティーを巡るのが生きがい。コンビニスイーツのレベルの高さにも驚かされる毎日。甘いものは世界を救うと本気で信じています。
biz_hustler,biz_h_42@example.jp,$2a$10$gEYnI1DoFwMlJhhmOOdkGe/I3nGiDhVGeJJGSNwn7giAMiAoaXg8C,「量より質」を重視する意識高い系ビジネスマン。生成AIの活用やKPI管理など、生産性を最大化するための仕事術を発信。朝活と読書が日課。常に成長を求めています。
kosodate_mama,koso_m_43@example.com,$2a$10$gEYnI1DoFwMlJhhmOOdkGe/I3nGiDhVGeJJGSNwn7giAMiAoaXg8C,元気いっぱいの子供たちに振り回される子育てママ。幼稚園の準備や終わらない家事に奮闘中。時々見せてくれる子供の笑顔と、一人のバスタイムが唯一の癒やしです。
idol_otaku,idol_o_44@example.ne.jp,$2a$10$gEYnI1DoFwMlJhhmOOdkGe/I3nGiDhVGeJJGSNwn7giAMiAoaXg8C,推しのアイドルに人生と給料のすべてを捧げています！現場参戦、グッズ集め、布教活動が日課。推しが尊すぎて毎日語彙力を失っています。推しの幸せが私の幸せ。
expat_worker,expat_w_45@example.jp,$2a$10$gEYnI1DoFwMlJhhmOOdkGe/I3nGiDhVGeJJGSNwn7giAMiAoaXg8C,シンガポール駐在員。東南アジアの活気とスピード感の中で、日々プレッシャーと戦いながら働いています。時差や文化の違いに戸惑いつつも、日本食の偉大さを痛感中。
alpine_climber,alpine_c_46@example.com,$2a$10$gEYnI1DoFwMlJhhmOOdkGe/I3nGiDhVGeJJGSNwn7giAMiAoaXg8C,冬の八ヶ岳から北アルプスまで、本格的な雪山登山に挑むアルピニスト。アイゼンの音と氷点下の静寂を愛する。山では常に「技術より判断力」を肝に銘じています。
book_reader,book_r_47@example.jp,$2a$10$gEYnI1DoFwMlJhhmOOdkGe/I3nGiDhVGeJJGSNwn7giAMiAoaXg8C,純文学から海外小説まで、活字中毒の読書垢。カズオ・イシグロやドストエフスキーなどの名作を静かな夜に読むのが至福。積読本がタワー化しているのが最近の悩み。
drinker_life,drinker_l_48@example.com,$2a$10$gEYnI1DoFwMlJhhmOOdkGe/I3nGiDhVGeJJGSNwn7giAMiAoaXg8C,お酒を愛し、お酒に生かされている飲兵衛。ビール、日本酒、ホッピーとなんでもござれ。痛風予備軍と診断されつつも、休日の昼飲みと二日酔いを繰り返すダメな大人です。
beauty_mens,beauty_m_49@example.ne.jp,$2a$10$gEYnI1DoFwMlJhhmOOdkGe/I3nGiDhVGeJJGSNwn7giAMiAoaXg8C,美意識高めの美容男子。最新のスキンケア、飲む日焼け止め、ホワイトニングなど、自分磨きに余念がありません。努力すればするほど結果が出る美容の世界が大好きです。
yami_sub,yami_s_50@example.jp,$2a$10$gEYnI1DoFwMlJhhmOOdkGe/I3nGiDhVGeJJGSNwn7giAMiAoaXg8C,毎日が辛くて消えたい。SNSのキラキラした世界を見ると自分が惨めになる。誰にも言えない本音やネガティブな感情をここに吐き出します。リスカ跡が消えない。
gadget_geek,gadget_g_51@example.com,$2a$10$gEYnI1DoFwMlJhhmOOdkGe/I3nGiDhVGeJJGSNwn7giAMiAoaXg8C,最新ガジェットとスマートホーム化に命を懸けるオタク。ARグラスや新しい通信規格など、テクノロジーの進化を自ら検証しないと気が済まない。配線整理が趣味。
exam_student,exam_s_52@example.jp,$2a$10$gEYnI1DoFwMlJhhmOOdkGe/I3nGiDhVGeJJGSNwn7giAMiAoaXg8C,資格試験に向けて勉強漬けの日々。精神的にも肉体的にも限界ギリギリのため、投稿は単語のみの超短文になりがち。寝不足とプレッシャーで常に「無理」「絶望」と呟いています。
camera_oogiri,camera_o_53@example.com,$2a$10$gEYnI1DoFwMlJhhmOOdkGe/I3nGiDhVGeJJGSNwn7giAMiAoaXg8C,ライカを愛用するカメラ女子ですが、なぜか「写真で一言」的な大喜利にハマっています。美しい風景写真と、シュールな大喜利回答のギャップをお楽しみください。
ramen_evaluator,ramen_e_54@example.ne.jp,$2a$10$gEYnI1DoFwMlJhhmOOdkGe/I3nGiDhVGeJJGSNwn7giAMiAoaXg8C,年間数百杯のラーメンを食べ歩く愛好家。家系から二郎系、淡麗系まで幅広く網羅。スープの味や待ち時間、総合点数を簡潔にストイックに記録していくスタイルです。
vtuber_liver,vtuber_l_55@example.jp,$2a$10$gEYnI1DoFwMlJhhmOOdkGe/I3nGiDhVGeJJGSNwn7giAMiAoaXg8C,個人勢VTuber！ゲーム実況、歌枠、雑談、そしてリスナー参加型の大喜利企画で毎日ワイワイ配信中。スパチャへの感謝と、ハイテンションなノリでみんなを笑顔にします！
news_reporter,news_r_56@example.com,$2a$10$gEYnI1DoFwMlJhhmOOdkGe/I3nGiDhVGeJJGSNwn7giAMiAoaXg8C,現場の最前線を走る報道記者。事件、事故、スポーツの歴史的瞬間から、GWの渋滞情報まで、社会の「今」を速報でお届けします。客観的事実を伝えることが使命。
shrine_visitor,shrine_v_57@example.jp,$2a$10$gEYnI1DoFwMlJhhmOOdkGe/I3nGiDhVGeJJGSNwn7giAMiAoaXg8C,全国の神社仏閣を巡り、御朱印を集めています。手水舎の氷や境内の花々など、季節の移ろいを感じながら、神聖な空気の中で心を清める時間が何よりの喜びです。
game_dev,game_d_58@example.com,$2a$10$gEYnI1DoFwMlJhhmOOdkGe/I3nGiDhVGeJJGSNwn7giAMiAoaXg8C,日夜バグと戦うゲーム開発エンジニア（プログラマー）。Unreal Engineでの物理演算や仕様変更に振り回され、レッドブルを片手に徹夜でデバッグ作業をする社畜ゲーマー。
track_runner,track_r_59@example.ne.jp,$2a$10$gEYnI1DoFwMlJhhmOOdkGe/I3nGiDhVGeJJGSNwn7giAMiAoaXg8C,自己ベスト更新を目指してストイックに走り続ける陸上選手・市民ランナー。日々の走行距離、タイム、心拍数（HR）、インターバル走の記録などを淡々と書き留めます。
fortune_teller,fortune_t_60@example.jp,$2a$10$gEYnI1DoFwMlJhhmOOdkGe/I3nGiDhVGeJJGSNwn7giAMiAoaXg8C,星の配置（占星術）やタロットから運命を読み解く占い師。新月・満月のメッセージや水星逆行の注意喚起などを発信。時に大喜利のようなユーモアも交えて心を軽くします。
history_doc,history_d_61@example.com,$2a$10$gEYnI1DoFwMlJhhmOOdkGe/I3nGiDhVGeJJGSNwn7giAMiAoaXg8C,古文書の解読や山城の土塁観察にロマンを見出す筋金入りの歴史マニア。現代の出来事を、江戸時代や戦国時代の歴史的背景と結びつけて考察するのが得意です。
nursery_teacher,nursery_t_62@example.jp,$2a$10$gEYnI1DoFwMlJhhmOOdkGe/I3nGiDhVGeJJGSNwn7giAMiAoaXg8C,体力勝負の保育士！子どもたちの可愛いエピソードや、季節の製作物の裏話、終わらない事務作業の愚痴などを呟きます。感染症の流行にビクビクしながら毎日奮闘中。
prowrestling_fan,prowres_f_63@example.com,$2a$10$gEYnI1DoFwMlJhhmOOdkGe/I3nGiDhVGeJJGSNwn7giAMiAoaXg8C,プロレスをこよなく愛する熱狂的ファン！後楽園ホールや東京ドームの現場参戦が生きがい。場外乱闘や魂のタイトルマッチに熱狂し、推しレスラーの雄姿を讃えます。
ura_shinjitsu,ura_s_money@example.jp,$2a$10$gEYnI1DoFwMlJhhmOOdkGe/I3nGiDhVGeJJGSNwn7giAMiAoaXg8C,【月収100万超え続出】メディアが隠す日本の真実と、どん底から這い上がる錬金術を暴露します。情弱から抜け出したい人はプロフリンクの無料動画へ。炎上覚悟で発信中🔥
english_tutor,english_t_65@example.com,$2a$10$gEYnI1DoFwMlJhhmOOdkGe/I3nGiDhVGeJJGSNwn7giAMiAoaXg8C,楽しく学べる英会話講師。日常会話で使える英語フレーズや、時事ネタを取り入れた英語表現を発信。生徒さんの成長を見守るのが何よりのやりがいです。Practice makes perfect!
architect_mind,architect_m_66@example.jp,$2a$10$gEYnI1DoFwMlJhhmOOdkGe/I3nGiDhVGeJJGSNwn7giAMiAoaXg8C,空間の在り方を追求する建築家。コンクリートの打設からモダニズム建築の視察まで、建築物に対する哲学的な考察を呟きます。ガウディのサグラダ・ファミリアには特別な思いあり。
miniature_craft,miniature_c_67@example.com,$2a$10$gEYnI1DoFwMlJhhmOOdkGe/I3nGiDhVGeJJGSNwn7giAMiAoaXg8C,1/12スケールの世界を創り出すミニチュア職人。樹脂粘土やヒノキ棒を使って、おせち料理や和室の障子などを極限の緻密さで再現。老眼とアロンアルファの付着と戦っています。
mountain_rescue,mountain_r_68@example.ne.jp,$2a$10$gEYnI1DoFwMlJhhmOOdkGe/I3nGiDhVGeJJGSNwn7giAMiAoaXg8C,山岳救助隊員。雪崩や滑落事故の最前線で命を救う。軽装備の登山者への厳しい警告や、冬山の恐ろしさ、そして日々の過酷な訓練の様子を現場からリアルに発信します。
sf_writer,sf_w_69@example.jp,$2a$10$gEYnI1DoFwMlJhhmOOdkGe/I3nGiDhVGeJJGSNwn7giAMiAoaXg8C,ディストピアやAIの進化をテーマにするSF作家。現実世界が次第にSF小説に近づいていく様を斜に構えて観察。深夜の執筆作業とゲラチェックの苦悩を呟いています。
music_producer,music_p_70@example.com,$2a$10$gEYnI1DoFwMlJhhmOOdkGe/I3nGiDhVGeJJGSNwn7giAMiAoaXg8C,トラックメイクとミックスに魂を込める音楽プロデューサー。深夜のスタジオでシンセサイザーの波形と睨めっこ。スポーツの熱狂や建築物からインスピレーションを得て曲を作ります。
tsuyoshi_gym,tsu_g_muscle@example.com,$2a$10$gEYnI1DoFwMlJhhmOOdkGe/I3nGiDhVGeJJGSNwn7giAMiAoaXg8C,筋トレが趣味の理学療法士。解剖学に基づいた効果的なトレーニング方法を紹介。特技はデータ分析。筋肉の成長を数値化して管理しています。努力は裏切らない！理想の体を目指して共に頑張りましょう。
eri_follower,eri_f_dream@example.jp,$2a$10$gEYnI1DoFwMlJhhmOOdkGe/I3nGiDhVGeJJGSNwn7giAMiAoaXg8C,フリーターです。将来に不安を感じて情報収集アカウントを作りました。ura_shinjitsuさんの言葉に感銘を受けて、現在ネットビジネス勉強中！絶対人生変える！✨
yoshiko_ikari,yoshi_ikari@example.ne.jp,$2a$10$gEYnI1DoFwMlJhhmOOdkGe/I3nGiDhVGeJJGSNwn7giAMiAoaXg8C,世の中の理不尽が許せません。メディアが報じない隠された真実を知り、日本の未来を本気で憂慮しています。目覚めよ日本人。
mina_travel,mina_t_domestic@example.ne.jp,$2a$10$gEYnI1DoFwMlJhhmOOdkGe/I3nGiDhVGeJJGSNwn7giAMiAoaXg8C,国内旅行が趣味。特に温泉巡りとパワースポット巡りにハマっています。特技は旅行の計画。低予算で最大限に楽しむ方法を研究中。各地のご当地グルメ写真もたくさん載せます。旅は人生の洗濯！
